受访者,1.你在校园生活中，有没有遇到过需要别人帮忙的情况？可以具体讲一个最近的例子吗？,1. 追问： 当时是怎么解决的？/ 有没有觉得不方便或不满意的地方？,2.如果你现在需要找人帮忙，一般会通过什么方式？（比如微信群、朋友圈、熟人等）,2.追问：这些方式最大的不足是什么？ / 有没有遇到“找不到人 / 不靠谱 / 沟通麻烦”的情况？ ,3.如果有一个校园互助平台，你最希望它帮你解决什么问题？,3.追问：是“找人快”还是“更安全可靠”？/有没有你觉得“必须要有”的功能？,4.你在使用这类平台时，最担心的是什么？（比如被骗、被放鸽子等）,4.追问：什么机制能让你更放心？（实名认证 / 评价系统 / 押金等）/你能接受学号认证吗？为什么？ ,5.如果你在平台上帮助别人，你更希望得到什么回报？（金钱 / 积分 / 荣誉等）,5.追问：积分这种方式你觉得有吸引力吗？/ 什么情况下你愿意长期使用这个平台？
同学A,最近球没气了，没有打气筒。,找了同学借打气筒。没有觉得不方便不满意的地方。,微信，或者直接线下找本人。,有时候找不到人。,寻找丢失物品以及交友,寻物。,被骗被放鸽子都是最担心的,实名评价和押金结合，接受学号认证，因为放心不担心会被骗,拾金不昧”，交个朋友即可,助人和被帮助的效率高回应率高的情况下，还要尽可能的覆盖整个校园
同学B,有 请假对上课内容不了解 请求别人帮我录音,没,发微信找熟人,没有 朋友都很靠谱,未来规划 学习生活,安全可靠 帮助公开 比如某些成功的例子放出来 失败的也可以,被误导,实名认证 可以,荣誉,没吸引力 确实有帮助 就像ai确实有用一样
同学C,我需要买烟，但是不能网上售卖,自己去买,陌生人吧,感觉不好找人的，特别是阴间时间,跑腿,有赔付功能,时效,补偿金,金钱,可以换钱
同学D,有 ，实验课不懂的问题互相沟通,就是直接问啊,一般不帮忙,最大的不足就是我不知道，我也懒得去想,学生诉求上报学校更有渠道,不知道,信用和隐私,学生认证可以，暂时我想不出让我信任的机制,等价交换，够价值我都接受,没有，不知道
同学E,学校要紧急交一个东西，而我恰好不在学校,寻找室友帮助/没有不方便,熟人,需要处理好与室友的关系，无法确定别人帮忙是否符合自己的需求,解决一些我对学业或校园生活的疑问,更安全可靠/能实时询问进度,拿钱不干事,实名认证/能，相当于一道保险，大学生比较在乎声誉,金钱,有一定吸引力，但是积分要可以兑换不同等级的礼品，不论多少都能兑换
同学F,有的，比如实验数据需要张图没打印又不方便，最好找个人帮你打印顺路带来,微信联系舍友,熟人,大家都有自己的事，未必方便帮你,经验咨询，学习等,找人快,被骗，或被放鸽子,评价系统，能接受，是一层身份的确认和保障,金钱,看积分的用途吧，用户要足够多切可靠
